pid,rid,verb,verbstem,sentence,ISO3,object,objectcleanpp,objecttype,label1,label2,group10606,5695,killing,kill,"Besides, troops on patrol ahead of the forward defence line in the Muhamalai general area, 3.5km east of Eluthumadduval, identified a hideout of the LTTE and attacked it, killing three LTTE cadres in the shoot out, on November 25.",LKA,three LTTE cadres in the shoot out,ltte cadres shoot out,person,terrorist,not-assigned,NA28087,16900,arrested,arrest,"On the same day, four National Liberation Front of Tripura (NLFT) cadres were arrested from Singlu in the Jampui hill range of North Tripura district.",IND,four National Liberation Front of Tripura ( NLFT ) cadres from Singlu,national liberation front nlft cadres singlu,person,terrorist,not-assigned,NA45744,26214,arrested,arrest,"Two unidentified Muslim United Liberation Tigers of Assam (MULTA) cadres were arrested from the Simbargaon area in the Kokrajhar district on September 12, according to Press Trust of India.",IND,Two unidentified Muslim United Liberation Tigers of Assam ( MULTA ) cadres from the Simbargaon area,unidentified muslim united liberation tigers assam multa cadres area,person,terrorist,not-assigned,NA141200,68946,arrested,arrest,"The arrested ICS cadres are Nur Mohammad, Nazrul Islam, Iama Hossain Shoag, Azmir Imtiaz Ahmed, Kawser Hamid and the BNP man is Firoz Alam.",BGD,ICS cadres,ics cadres,person,terrorist,not-assigned,NA92637,47737,arrested,arrest,"Also, SFs arrested two Kanglei Yawol Kanna Lup (KYKL) cadres, identified as Leishram Sobha Singh, (32) and Thoudam Gonakhesor (35), from Haoreibi Mayai Leikai area in Thoubal District and handed them over to Mayang Imphal Police station.",IND,"two Kanglei Yawol Kanna Lup ( KYKL ) cadres , identified as Leishram Sobha Singh , ( 32 ) and Thoudam Gonakhesor ( 35 )",kanglei yawol kanna lup kykl cadres identified leishram sobha singh and thoudam gonakhesor,person,terrorist,not-assigned,NA79690,41560,arrested,arrest,"Earlier in the night of December 20, two ICS cadres - Ismail Hossain, and Anwarul Islam, were arrested from Shahid Akhtar Ali Moon Hall.",BGD,"two ICS cadres - Ismail Hossain , and Anwarul Islam , from Shahid Akhtar Ali Moon Hall",ics cadres ismail hossain and anwarul islam shahid akhtar ali moon hall,person,terrorist,not-assigned,NA82042,42630,arrested,arrest,"The German Police arrested six Liberation Tigers of Tamil Eelam (LTTE) cadres suspected of raising funds for the outfit, reports Colombo Page.",LKA,six Liberation Tigers of Tamil Eelam ( LTTE ) cadres suspected of raising funds for the outfit,liberation tigers tamil eelam ltte cadres suspected raising funds outfit,person,terrorist,not-assigned,NA45881,26280,killed,kill,"Three Liberation Tigers of Tamil Eelam (LTTE) cadres were killed by the police in an encounter that lasted for five hours at Isamalai in the Murunkan area of Mannar district on September 20, according to Daily News.",LKA,Three Liberation Tigers of Tamil Eelam ( LTTE ) cadres,liberation tigers tamil eelam ltte cadres,person,terrorist,not-assigned,NA42355,24853,killed,kill,"A spokesperson for the Karuna group, T. Thuyavan, claimed they killed Ramanan who was deputy head of the LTTE <fc><be><8c><93><a4><bc>Military wing' of the Batticaloa district.",LKA,Ramanan who was deputy head of the LTTE < fc > < be > < 8c > < 93 > < a4 > < bc > Military wing ' of the Batticaloa district,ramanan who was deputy head ltte fc be bc military wing district,person,terrorist,not-assigned,NA85395,44241,arrested,arrest,"""During the month of May alone we have arrested 77 hardcore Tigers who are believed to have been directly involved in terror activities,"" he said.",LKA,77 hardcore Tigers who are believed to have been directly involved in terror activities,hardcore tigers who are believed to have been directly involved terror activities,person,terrorist,not-assigned,NA76362,39884,arrested,arrest,"A Kanglei Yawol Kanna Lup (KYKL) cadre, Yumnam Naocha Singh, was arrested by a combined force of the Imphal East District Police and Assam Rifles personnel from Lamphel.",IND,"A Kanglei Yawol Kanna Lup ( KYKL ) cadre , Yumnam Naocha Singh ,",kanglei yawol kanna lup kykl cadre yumnam naocha singh,person,terrorist,not-assigned,NA31918,18997,arrested,arrest,"Meanwhile, three Dima Halim Daoga (DHD) cadres were arrested by the security forces from an unspecified place in the Cachar district on November 25.",IND,three Dima Halim Daoga ( DHD ) cadres,dima halim daoga dhd cadres,person,terrorist,not-assigned,NA84206,43652,surrendered,surrend,"Two United Liberation Front of Asom (ULFA) militants, Prafulla Cho and Madhav Bora, surrendered before Border Security Force (BSF) on May 7 at Salmora BSF camp in Golaghat, reports Telegraph.",IND,Two United Liberation Front of Asom ( ULFA ),united liberation front asom ulfa,person,terrorist,not-assigned,NA8492,3931,killed,kill,"In another ambush laid in the Kebithigollewa general area, near Welioya, an unspecified number of LTTE rebels were killed, while two soldiers were wounded.",LKA,an unspecified number of LTTE rebels,unspecified number ltte rebels,person,terrorist,not-assigned,NA134723,66292,arrested,arrest,Law enforcers arrested three cadres of ICS during their picketing.,BGD,three cadres of ICS,cadres ics,person,terrorist,not-assigned,NA94091,48515,arrested,arrest,"Sify.com reports that three armed cadres of the Communist Party of India-Maoist (CPI-Maoist) were arrested in from Pakhanjoor area in Kanker District on March 4. Officials at Police Headquarters said that District Force personnel arrested the three cadres when they were holding a meeting in the forested pocket while several others, managed to escape.",IND,the three cadres,cadres,person,terrorist,not-assigned,NA11089,6048,killed,kill,"Government troops on a dominating patrol, on December 18, engaged a group of Liberation Tigers of Tamil Eelam (LTTE) rebels in the Ethawetunuwewa general area, 6km away from Welioya, and killed two LTTE men, the Army said.",LKA,two LTTE men,ltte men,person,terrorist,not-assigned,NA28386,17076,killed,kill,"According to the Daily Star, cadres of the outlawed left-wing extremist Purbo Banglar Communist Party (PBCP) killed two operatives of the vigilante Islamist group Jagrata Muslim Janata Bangladesh (JMJB), injured six others and launched arson attacks on three houses in Naogaon on May 17.",BGD,two operatives of the vigilante Islamist group Jagrata Muslim Janata Bangladesh ( JMJB ),operatives vigilante islamist group jagrata muslim janata bangladesh jmjb,person,terrorist,not-assigned,NA38294,22471,arrested,arrest,"On the same day, Rapid Action Battalion personnel arrested Abu Taleb, another JMB cadre, at Sonakur in the Sadar sub-district of Gopalganj district.",BGD,"Abu Taleb , another JMB cadre ,",abu taleb jmb cadre,person,terrorist,not-assigned,NA86123,44584,attacked,attack,"Also, the sources added that fighter jets attacked a Taliban (TTP)-run makeshift hospital in Upper Orakzai late on June 27, killing 40 TTP militants under treatment at the facility.",PAK,a Taliban,taliban,person,terrorist,not-assigned,NA42206,24756,surrendered,surrend,"Two Karbi Longri North Cachar Hills Liberation Front (KLNLF) cadres, <fc><be><8c><93><a4><bc>corporal' Kolam Sing Engti and Babu Ram Teron, surrendered at Diphu, headquarters of the Karbi Anglong district, on May 10, according to UNI.",IND,"Two Karbi Longri North Cachar Hills Liberation Front ( KLNLF ) cadres , < fc > < be > < 8c > < 93 > < a4 > < bc > corporal ' Kolam Sing Engti and Babu Ram Teron ,",karbi longri north cachar hills liberation front klnlf cadres fc be bc corporal kolam sing engti and babu ram teron,person,terrorist,not-assigned,NA82128,42672,arrested,arrest,"Meanwhile, a United Liberation Front of Asom (ULFA) linkman, identified as Dipak Bhumij of Tiphuk tea estate, was arrested by the Security Forces (SFs) at Sivasagar.",IND,"a United Liberation Front of Asom ( ULFA ) linkman , identified as Dipak Bhumij of Tiphuk tea estate ,",united liberation front asom ulfa linkman identified dipak bhumij tea estate,person,terrorist,not-assigned,NA67232,35616,arrested,arrest,"The Army arrested one ULFA linkman, Lachit Rajkonwar, from his residence at Bengenabari in Charaideo subdivision of Sivsagar district on November 3, reports Sentinel.",IND,"one ULFA linkman , Lachit Rajkonwar , from his residence at Bengenabari in Charaideo subdivision of Sivsagar district on November 3 , reports Sentinel",ulfa linkman lachit rajkonwar his residence subdivision district november reports sentinel,person,terrorist,not-assigned,NA56888,31454,killed,kill,"Troops retaliated and killed three LTTE cadres at Velankulam, west of Omanthe in the Vavuniya district when they were fired upon by the militants.",LKA,three LTTE cadres,ltte cadres,person,terrorist,not-assigned,NA56357,31238,arrested,arrest,"Another KRA cadre, Touthang, was arrested from New Checkon area in the same district.",IND,"Another KRA cadre , Touthang , from New Checkon area in the same district",kra cadre touthang area same district,person,terrorist,not-assigned,NA65898,35081,killed,kill,Seven more LTTE cadres were killed during separate clashes with the troops in the Vannavikulam and north of Karamaddakulam areas of Kilinochchi district.,LKA,Seven more LTTE cadres,more ltte cadres,person,terrorist,not-assigned,NA34388,20392,killed,kill,Two cadres of the Gono Mukti Fouz (GMF) and another of the Janajuddha faction of the Purbo Banglar Communist Party (PBCP) were reportedly killed during an encounter with the police at Dahkula village in the Kushtia district and Teltupi village in Jhenidah district respectively on April 3. Police recovered a shutter gun and 50 bullets from the first incident site.,BGD,Two cadres of the Gono Mukti Fouz ( GMF ) and another of the Janajuddha faction of the Purbo Banglar Communist Party ( PBCP ),cadres gono mukti fouz gmf and janajuddha faction purbo banglar communist party pbcp,person,terrorist,not-assigned,NA8245,3815,killed,kill,Five rebels were also reported to be killed in these operations.,NPL,Five rebels,rebels,person,terrorist,not-assigned,NA136161,66768,arrested,arrest,"Security Forces (SFs) arrested a female cadre of the Songbijit faction of the (NDFB-IKS), Sangita Muchahary (23), at Rangajan Tiniali in Goalpara District on December 5, reports The Telegraph.",IND,"a female cadre of the Songbijit faction of the ( NDFB - IKS ) , Sangita Muchahary ( 23 ) ,",female cadre songbijit faction iks sangita muchahary,person,terrorist,not-assigned,NA129356,64075,arrested,arrest,"The Sangai Express arrested a Kangleipak Communist Party-Military Council (KCP-MC) cadre, identified as Laishram Nanao alias Rohit, in Imphal East District on June 29.",IND,"a Kangleipak Communist Party - Military Council ( KCP - MC ) cadre , identified as Laishram Nanao alias Rohit , in Imphal East District on June 29.",kangleipak communist party military council kcp mc cadre identified laishram nanao alias rohit district june,person,terrorist,not-assigned,NA7371,3374,killed,kill,"Two Liberation Tigers of Tamil Eelam (LTTE) rebels were killed in clashes with government troops in the Periyamurippu, 35 km away from Vavuniya, on May 23, a delayed report stated.",LKA,Two Liberation Tigers of Tamil Eelam ( LTTE ) rebels,liberation tigers tamil eelam ltte rebels,person,terrorist,not-assigned,NA36972,21818,killed,kill,"Three cadres of the Biplobi Communist Party (BCP), identified as Raju alias Killer Raju, Abu Bakkar alias Mujibar and Alamgir alias Killer Alamgir, were killed in separate encounters with the Rapid Action Battalion (RAB) personnel at Landari in the Khulna district and Shankarpasha in the Jessore district on August 13.",BGD,"Three cadres of the Biplobi Communist Party ( BCP ) , identified as Raju alias Killer Raju , Abu Bakkar alias Mujibar and Alamgir alias Killer Alamgir ,",cadres biplobi communist party bcp identified raju alias killer abu bakkar mujibar and alamgir,person,terrorist,not-assigned,NA44769,25808,arrested,arrest,A LTTE cadre committed suicide as Wattala Police in the Jaffna district arrested two LTTE suspects.,LKA,two LTTE suspects,ltte suspects,person,terrorist,not-assigned,NA423,227,arrested,arrest,"In a search operation in Colombo, police arrested five hardcore LTTE suspects, on April 4.",LKA,five hardcore LTTE suspects,hardcore ltte suspects,person,terrorist,not-assigned,NA69955,36829,arrested,arrest,"Further, two Kuki Liberation Army (KLA) cadres, Helun Taothang alias Apao and Paokhansiem Guite alias Seiem, were arrested by the Imphal East District Police from New Checkon on January 21, reports Imphal Free Press.",IND,"two Kuki Liberation Army ( KLA ) cadres , Helun Taothang alias Apao and Paokhansiem Guite alias Seiem ,",kuki liberation army kla cadres helun taothang alias apao and paokhansiem guite seiem,person,terrorist,not-assigned,NA50759,28582,arrested,arrest,"Troops of Rajputana Rifles arrested three People's United Liberation Front (PULF) cadres, Manir Khan, Sujan Das and Seichan Hmar, and recovered one single barrel gun, one double barrel gun, one country-made pistol along with one live round and 12 cartridges from their possession at Butangkhal.",IND,"three People 's United Liberation Front ( PULF ) cadres , Manir Khan , Sujan Das and Seichan Hmar",people united liberation front pulf cadres manir khan sujan das and seichan hmar,person,terrorist,not-assigned,NA34341,20374,killed,kill,"On the same day, one insurgent was killed at Bhagwanpur area of Nawalparasi district.",NPL,one insurgent,insurgent,person,terrorist,not-assigned,NA38314,22479,wounded,wound,"On October 18, unidentified Liberation Tigers of Tamil Eelam (LTTE) cadres shot dead a police personnel, identified as Kamal Indrajith, and wounded another in the Kalavanchikudy area of Batticaloa district.",LKA,cadres another,cadres,person,terrorist,not-assigned,NA37695,22190,arrested,arrest,"On September 17, a hardcore National Socialist Council of Nagaland-Isak-Muivah (NSCN-IM) cadre, S. K. Shamson Lamkang, was arrested during search operations in and around the Paona Bazaar of Imphal city.",IND,"a hardcore National Socialist Council of Nagaland - Isak - Muivah ( NSCN - IM ) cadre , S. K. Shamson Lamkang ,",hardcore national socialist council muivah nscn im cadre shamson lamkang,person,terrorist,not-assigned,NA29972,18066,killed,kill,"A Lashkar-e-Toiba (LeT) cadre, identified as Mohammed Altaf, was killed by the security forces at village Hamuta in the Poonch district.",IND,"A Lashkar - e - Toiba ( LeT ) cadre , identified as Mohammed Altaf ,",lashkar toiba let cadre identified mohammed altaf,person,terrorist,not-assigned,NA42989,25124,arrested,arrest,"Security force (SF) personnel arrested a United National Liberation Front (UNLF) cadre, Arangbam Satrajit alias Naopet, from Khurai Nandeibam Leikai in the Imphal city on June 12.;",IND,"a United National Liberation Front ( UNLF ) cadre , Arangbam Satrajit alias Naopet , from Khurai Nandeibam Leikai in the Imphal city",united national liberation front unlf cadre arangbam satrajit alias naopet khurai nandeibam leikai city,person,terrorist,not-assigned,NA85882,44468,assaulted,assault,"Meanwhile, Bangladesh Chhatra League (BCL) activists on June 21 assaulted an Islami Chhatra Shibir (ICS) cadre at Rajshahi University (RU) and handed him over to Police.",BGD,an Islami Chhatra Shibir ( ICS ) cadre,islami chhatra shibir ics cadre,person,terrorist,not-assigned,NA48658,27555,attacked,attack,The home guards with the assistance of the Army attacked the LTTE cadres forcing them to escape.,LKA,the LTTE cadres forcing them to escape,ltte cadres forcing them to escape,person,terrorist,not-assigned,NA106316,54351,arrested,arrest,SFs also arrested one cadre belonging to Azad faction of People's United Liberation Front (PULF-Azad) identified as Muhammad Mujibur Rahaman alias Mujib at Nongpok Sekmai Bazar in Thoubal District on February 25.,IND,one cadre belonging to Azad faction of People 's United Liberation Front ( PULF - Azad ) identified as Muhammad Mujibur Rahaman alias Mujib at Nongpok Sekmai Bazar in Thoubal District on February 25.,cadre belonging to azad faction people united liberation front pulf identified muhammad mujibur rahaman alias mujib february,person,terrorist,not-assigned,NA12328,7033,killed,kill,"Yet another insurgent was killed in Lamjung, the Defence Ministry announced.",NPL,Yet another insurgent,yet insurgent,person,terrorist,not-assigned,NA56827,31435,killed,kill,"On the same day, troops retaliated and killed five LTTE cadres in the Muhamalai area of Jaffna district when they were attacked by the militants.",LKA,five LTTE cadres,ltte cadres,person,terrorist,not-assigned,NA35144,20823,killed,kill,"In another incident, an insurgent was killed at Chandbela village in the Sunsari district.",NPL,an insurgent,insurgent,person,terrorist,not-assigned,NA38736,22691,wounded,wound,"In a separate incident, suspected cadres of the <fc><be><8c><93><a4><bc>Colonel' Karuna faction allegedly shot at and wounded two Liberation Tigers of Tamil Eelam (LTTE) cadres in the Vantharamoolai area of Batticaloa district.",LKA,two Liberation Tigers of Tamil Eelam ( LTTE ) cadres in the Vantharamoolai area of Batticaloa district,liberation tigers tamil eelam ltte cadres area district,person,terrorist,not-assigned,NA87375,45118,arrested,arrest,Two suspected women cadres were also arrested from the encounter site.,IND,Two suspected women cadres from the encounter site,suspected women cadres encounter site,person,terrorist,not-assigned,NA42340,24838,killed,kill,Five Liberation Tigers of Tamil Eelam (LTTE) cadres were killed by cadres of the <fc><be><8c><93><a4><bc>Colonel' Karuna group in the Sampur area of Trincomalee district on May 19. ;,LKA,Five Liberation Tigers of Tamil Eelam ( LTTE ) cadres,liberation tigers tamil eelam ltte cadres,person,terrorist,not-assigned,NA68358,36133,arrested,arrest,"A suspected People's United Liberation Front (PULF) cadre, Nijam Uddin, was arrested by troops based at Labak on December 5 from Badri Bridge on National Highway -53 under Lakhipur police station in the Cachar district, according to Sentinel.",IND,"A suspected People 's United Liberation Front ( PULF ) cadre , Nijam Uddin ,",suspected people united liberation front pulf cadre nijam uddin,person,terrorist,not-assigned,NA12862,7434,arrested,arrest,65 other cadres were arrested in the crackdown which continued on March 29.,PAK,65 other cadres,other cadres,person,terrorist,not-assigned,NA105361,53896,arrested,arrest,"Meanwhile, SFs arrested a cadre of Mobile Task Force faction of Kangleipak Communist Party (KCP-MTF), identified as Chingkham Chandramani alias Mani, from Wangkhei Andro Parking in Imphal East District along with one .9mm",IND,a cadre of Mobile Task Force faction of Kangleipak Communist Party ( KCP - MTF ),cadre mobile task force faction kangleipak communist party kcp mtf,person,terrorist,not-assigned,NA12293,7006,killed,kill,"Further, an unspecified number of insurgents were killed in retaliatory firing by the police when the insurgents attacked a police outpost, on February 27, in Nawalpur, in Sarlahi district.",NPL,an unspecified number of insurgents,unspecified number insurgents,person,terrorist,not-assigned,NA108952,55544,arrested,arrest,The Police said that the cadres were arrested in connection with a case filed by police for attacking and injuring Policemen who were discharging their duties at Hasan Ali Government High School ground on January 29 at the time of Bangladesh Nationalist Party (BNP)'s mass rally there.,BGD,the cadres,cadres,person,terrorist,not-assigned,NA30091,18131,arrested,arrest,"A person, identified as Mohammed Ibomcha, suspected to have links with either the People's Liberation Army (PLA) of Manipur or the Muslim United Liberation Tigers of Assam (MULTA) was arrested in this connection.",IND,"A person , identified as Mohammed Ibomcha , suspected to have links with either the People 's Liberation Army ( PLA ) of Manipur or the Muslim United Liberation Tigers of Assam ( MULTA )",person identified mohammed ibomcha suspected to have links either people liberation army pla or muslim united tigers assam multa,person,terrorist,not-assigned,NA119493,59805,arrested,arrest,"Separately, one United Liberation Front of Asom (ULFA) cadre, identified as Arup Nayak alias Nelo, was arrested by the Security Force (SF) personnel from Borpatra area under Borhat Police Station in the Sivsagar District.",IND,"one United Liberation Front of Asom ( ULFA ) cadre , identified as Arup Nayak alias Nelo ,",united liberation front asom ulfa cadre identified arup nayak alias nelo,person,terrorist,not-assigned,NA41918,24631,killed,kill,The Website further reported that two LTTE <fc><be><8c><93><a4><bc>auxiliary force' cadres were killed in a claymore mine attack allegedly carried out by the Sri Lankan Army in the LTTE-held area of Manalaru in the Mullaitivu district on April 29.,LKA,two LTTE < fc > < be > < 8c > < 93 > < a4 > < bc > auxiliary force ' cadres,ltte fc be bc auxiliary force cadres,person,terrorist,not-assigned,NA75066,39246,arrested,arrest,"Meanwhile, three cadres belonging to the Military Council faction of the Kangleipak Communist Party (KCP), identified as Ningthogjam Sunil Meitei, Premjit Meitei and A. Nanao Singh, were arrested by a combined force of the Assam Rifles and Thoubal District Police from Malom area on July 22, reports Imphal Free Press.",IND,"three cadres belonging to the Military Council faction of the Kangleipak Communist Party ( KCP ) , identified as Ningthogjam Sunil Meitei , Premjit Meitei and A. Nanao Singh ,",cadres belonging to military council faction kangleipak communist party kcp identified ningthogjam sunil meitei premjit and nanao singh,person,terrorist,not-assigned,NA18003,10494,killed,kill,"Separately, four insurgents were killed in Rolpa and a district committee member was shot dead in Siraha.",NPL,four insurgents,insurgents,person,terrorist,not-assigned,NA53948,30127,fired,fire,"Meanwhile, suspected Liberation Tigers of Tamil Eelam (LTTE) cadres opened fired on four transformers that distribute power to the Aliyadiwembu, Kolavil, Vammiady areas in the Akkaraipattu region of Ampara district on August 8.",LKA,suspected Liberation Tigers of Tamil Eelam ( LTTE ) cadres,suspected liberation tigers tamil eelam ltte cadres,person,terrorist,not-assigned,NA35409,20980,killed,kill,"On the same day, four Maoists were killed in the Dunger area of Dailekh district, while another insurgent was killed at Kudari in Jumla district.",NPL,another insurgent,insurgent,person,terrorist,not-assigned,NA33488,19887,surrendered,surrend,Official sources in Doda said cadres of the Hizb-ul-Mujahideen (HM) outfit could be responsible for the blast as Ahmed had deserted their outfit and surrendered before the police.,IND,cadres of the Hizb - ul - Mujahideen ( HM ) outfit,cadres hizb ul mujahideen hm outfit,person,terrorist,not-assigned,NA44451,25683,arrested,arrest,"Police also arrested three more HM cadres, Riaz Ahmed, Zahid and Zahoor Din, along with three Chinese grenades and Rupees 1.90 lakh in cash at Thathri in the Doda district.",IND,"three more HM cadres , Riaz Ahmed , Zahid and Zahoor Din , along with three Chinese grenades and Rupees 1.90 lakh in cash at Thathri in the Doda district",more hm cadres riaz ahmed zahid and zahoor din chinese grenades rupees cash doda district,person,terrorist,not-assigned,NA35041,20761,arrested,arrest,"On May 10, a Naga National Council (NNC) cadre, identified as Sanjrambam Ingocha Meitei, was arrested from the Thau ground area in Imphal West District.",IND,"a Naga National Council ( NNC ) cadre , identified as Sanjrambam Ingocha Meitei ,",naga national council nnc cadre identified sanjrambam ingocha meitei,person,terrorist,not-assigned,NA50681,28548,killed,kill,SFs confirm that 184 LTTE cadres were killed during this period.,LKA,184 LTTE cadres,ltte cadres,person,terrorist,not-assigned,NA40119,23344,arrested,arrest,"On January 8, Dibrugarh district police arrested four persons, including a woman identified as Dipali Gohain, for having links with the United Liberation Front of Asom (ULFA) from Chabua, according to Telegraph.",IND,"four persons , including a woman identified as Dipali Gohain , for having links with the United Liberation Front of Asom ( ULFA ) from Chabua",persons including woman identified dipali gohain having links united liberation front asom ulfa,person,terrorist,not-assigned,NA71071,37356,killed,kill,The sources said that five cadres of the banned Ansarul Islam (AI) outfit were killed.,PAK,five cadres of the banned Ansarul Islam ( AI ) outfit,cadres banned ansarul islam ai outfit,person,terrorist,not-assigned,NA105033,53762,kill,kill,"Taking strong cognizance of the GNLA's bid to kill three ANVC cadres, its spokesperson Torik Jangning Marak said, <fc><be><8c><b3><a4><bc>Situation will be worsened if the GNLA continues to target our cadres.<fc><be><8d><83><a4><bc>",IND,three ANVC cadres,anvc cadres,person,terrorist,not-assigned,NA66497,35299,arrested,arrest,"Rapid Action Battalion (RAB) personnel arrested four cadres of banned Islamist outfit Harkat-ul-Jihad-al Islami Bangladesh (HuJI-B) in Khalishpur area of Khulna district on October 14, reports Daily Star.",BGD,four cadres of banned Islamist outfit Harkat - ul - Jihad - al Islami Bangladesh ( HuJI - B ),cadres banned islamist outfit harkat ul jihad al islami bangladesh huji,person,terrorist,not-assigned,NA102729,52736,arrested,arrest,Two cadres identified as Mayo Khapai and Tazanlo Messen were arrested on November 14 and another two cadres identified as Monko Phaon and Tongku Tontang were arrested on November 15 along with one M-21 Chinese rifle.,IND,Two cadres identified as Mayo Khapai and Tazanlo Messen,cadres identified mayo khapai and tazanlo messen,person,terrorist,not-assigned,NA