pid,rid,verb,verbstem,sentence,ISO3,object,objectcleanpp,objecttype,label1,label2,group124485,62001,arrested,arrest,"In addition, SFs arrested an All Adivasi National Liberation Army (AANLA) militant, identified as Sunil Munda (35), from Hathimara in Udalguri District on February 23.",IND,"an All Adivasi National Liberation Army ( AANLA ) militant , identified as Sunil Munda ( 35 ) , from Hathimara in Udalguri District on February 23.",all adivasi national liberation army aanla militant identified sunil munda hathimara february,person,terrorist,not-assigned,NA110172,56029,arrested,arrest,SFs also arrested one People's Liberation Army (PLA) cadre identified as Lumpingning Kabui alias boy alias John from Khurai Popular High School in Imphal East District on June 16.,IND,one People 's Liberation Army ( PLA ) cadre identified as Lumpingning Kabui alias boy alias John from Khurai Popular High School in Imphal East District on June 16.,people liberation army pla cadre identified lumpingning kabui alias boy john khurai popular high school district june,person,terrorist,not-assigned,NA127203,63155,killed,kill,"Nationalist Socialist Council of Nagaland-Khole-Kitovi (NSCN-KK) militants opened fire and killed one Khaplang faction of NSCN (NSCN-K) militant, and a civilian near the Clock Tower Junction in Dimapur town of Dimapur District on May 6, reports Nagaland Post.",IND,"one Khaplang faction of NSCN ( NSCN - K ) militant , and a civilian near the Clock Tower Junction in Dimapur town of Dimapur District",khaplang faction militant and civilian town,person,terrorist,not-assigned,NA129659,64199,arrested,arrest,The Assam Rifles troops retaliated the fire and during the operation two cadres of Kuki Liberation Organization (KLO) were arrested while one cadre escaped.,IND,two cadres of Kuki Liberation Organization ( KLO ),cadres kuki liberation organization klo,person,terrorist,not-assigned,NA44862,25844,arrested,arrest,"Meanwhile, security force (SF) personnel arrested a Kuki Revolutionary Army (KRA) cadre, Yaikhom Anil alias Chinglemba, from Lamlong Bazaar in Imphal.",IND,"a Kuki Revolutionary Army ( KRA ) cadre , Yaikhom Anil alias Chinglemba , from Lamlong Bazaar in Imphal",kuki revolutionary army cadre yaikhom anil alias chinglemba,person,terrorist,not-assigned,NA19419,11220,arrested,arrest,"Four People's Liberation Army (PLA) terrorists, including three women, were arrested from Moirang Purel area, Imphal East district.",IND,"Four People 's Liberation Army ( PLA ) terrorists , including three women , from Moirang Purel area , Imphal East district",people liberation army pla terrorists including women area district,person,terrorist,not-assigned,NA26381,15914,surrendered,surrend,Four National Liberation Front of Tripura (NLFT) terrorists reportedly surrendered before the Sub-Divisional Magistrate of Bishalgarh subdivision in the West Tripura district on January 5.,IND,Four National Liberation Front of Tripura ( NLFT ),national liberation front nlft,person,terrorist,not-assigned,NA7068,3217,killed,kill,"In another incident, an activist of the Ikhawaan-ul-Muslimeen, a counter-insurgent (CI) outfit was killed while three SF personnel were injured in a grenade explosion at Ashmuqam in Anantnag district.",IND,a counter - insurgent ( CI ) outfit,counter insurgent ci outfit,person,terrorist,not-assigned,NA100352,51599,injured,injur,"Meanwhile, a highly placed Police source has confirmed that Hynniewtrep National Liberation Council (HNLC) <fc><be><8c><93><a4><bc>Commander-in-Chief' Bobby Marwein was injured in a gang war shoot-out but not dead, reports Shillong Times.",IND,Hynniewtrep National Liberation Council ( HNLC ) < fc > < be > < 8c > < 93 > < a4 > < bc > Commander-in-Chief ' Bobby Marwein,hynniewtrep national liberation council hnlc fc be bc commander in chief bobby marwein,person,terrorist,not-assigned,NA72846,38192,arrested,arrest,"Further, a People''s Liberation Army (PLA) cadre, Laishram Nongyai, was arrested by the Assam Rifles personnel near Thoubal market on May 7, according to Sangai Express.",IND,"a People '' s Liberation Army ( PLA ) cadre , Laishram Nongyai ,",people liberation army pla cadre laishram nongyai,person,terrorist,not-assigned,NA46326,26487,arrested,arrest,"Separately, SFs arrested a Kuki National Army (KNA) cadre, identified as Haopu Haokip, from the North AOC area of capital Imphal.;",IND,"a Kuki National Army ( KNA ) cadre , identified as Haopu Haokip , from the North AOC area of capital Imphal",kuki national army kna cadre identified haopu haokip aoc area capital,person,terrorist,not-assigned,NA100377,51611,arrested,arrest,"Further, SFs arrested one KCP cadre, identified as Kumam Akash Singh (19), from Moirang in Bishnupur District.",IND,"one KCP cadre , identified as Kumam Akash Singh ( 19 ) , from Moirang in Bishnupur District",kcp cadre identified kumam akash singh moirang,person,terrorist,not-assigned,NA58167,31962,killed,kill,"Elsewhere in the same district, one former United National Liberation Front (UNLF) cadre, Wakhem Purnachandra Singh, was killed by suspected militants at his residence at Kairang Litan Makhong under Heingang police station on the same night, reports Imphal Free Press.",IND,"one former United National Liberation Front ( UNLF ) cadre , Wakhem Purnachandra Singh ,",former united national liberation front unlf cadre wakhem purnachandra singh,person,terrorist,not-assigned,NA38831,22736,arrested,arrest,"In a separate incident, SFs arrested a Kangleipak Communist Party (KCP) militant, Mohammed Tomba, during a search operation in the Paobitek area on November 12.",IND,"a Kangleipak Communist Party ( KCP ) militant , Mohammed Tomba ,",kangleipak communist party kcp militant mohammed tomba,person,terrorist,not-assigned,NA70704,37175,arrested,arrest,"A Kangleipak Communist Party (KCP) cadre, identified as Akoijam Suresh Singh, was arrested by the Thoubal District Police during a search operation at Thoubal Wangmataba on February 20, reports Imphal Free Press.",IND,"A Kangleipak Communist Party ( KCP ) cadre , identified as Akoijam Suresh Singh ,",kangleipak communist party kcp cadre identified akoijam suresh singh,person,terrorist,not-assigned,NA55154,30696,arrested,arrest,"Elsewhere in the same district, one suspected National Liberation Front of Tripura (NLFT) militant, Biswamohan Tripura, was arrested from a hut near Purnaron Rouja Para under Longthorai Valley police station.",IND,"National Liberation Front of Tripura ( NLFT ) militant , Biswamohan Tripura , from a hut near Purnaron Rouja Para",national liberation front nlft militant hut,person,terrorist,not-assigned,NA51613,28983,arrested,arrest,"Meanwhile, police arrested Bikram Singh, a top ULFA cadre of the <fc><be><8c><93><a4><bc>27th battalion', near Kamalpur area under Changsari police station in the Kamrup district, reports Sentinel.",IND,"Bikram Singh , a top ULFA cadre of the < fc > < be > < 8c > < 93 > < a4 > < bc > 27th battalion '",bikram singh top ulfa cadre fc be bc th battalion,person,terrorist,not-assigned,NA90819,46718,arrested,arrest,"Separately, the Security Forces arrested an Over Ground Worker of Lashkar-e-Toiba (LeT), identified as Kasir Bashir Mir, from Handwara area of Kupwara District.",IND,"an Over Ground Worker of Lashkar - e - Toiba ( LeT ) , identified as Kasir Bashir Mir , from Handwara area of Kupwara District",over ground worker lashkar toiba let identified kasir bashir mir area,person,terrorist,not-assigned,NA12595,7244,arrested,arrest,Three ULFA terrorists were arrested from Balipara village and one from Shanristipur in Nalbari district.,IND,Three ULFA terrorists from Balipara village and one from Shanristipur in Nalbari district,ulfa terrorists village and shanristipur district,person,terrorist,not-assigned,NA55589,30904,arrested,arrest,"On October 10, police arrested a villager, Mahtaru, for assisting the Communist Party of India-Maoist (CPI-Maoist) cadres from Bendadi village under Churiya police station of Rajnandgaon district, reports Chhattisgarh 24x7.",IND,"a villager , Mahtaru , for assisting the Communist Party of India - Maoist ( CPI-M aoist ) cadres from Bendadi village under Churiya police station of Rajnandgaon district",villager mahtaru assisting communist party india maoist cpi aoist cadres village police station district,person,terrorist,maoist,NA96225,49628,arrested,arrest,"Kanglaonline reports that Security Forces (SFs) arrested a Kangleipak Communist Party (KCP), militant identified as one Md Raffid (26), from Phugakchao in Imphal West District on May 16.",IND,a Kangleipak Communist Party ( KCP ),kangleipak communist party kcp,person,terrorist,not-assigned,NA128748,63829,arrested,arrest,"However, KNF-N has said a press release that the outfit has no cadre by the name of Letginhao alias Abin alias Hegin alias Haopu who was reportedly arrested on June 15.",IND,Letginhao alias Abin alias Hegin alias Haopu who,alias abin hegin haopu who,person,terrorist,not-assigned,NA135676,66618,killed,kill,"One Zeliangrong United Front (ZUF) militant was reportedly killed and scores injured in a factional clash with Nationalist Socialist Council of Nagaland-Isak-Muivah (NSCN-IM) near Lukhambi Part-1 or Khumji village in Tamenglong District on November 26, reports The Sangai Express.",IND,One Zeliangrong United Front ( ZUF ) militant,zeliangrong united front zuf militant,person,terrorist,not-assigned,NA28572,17225,arrested,arrest,"Separately, a 'district commander' of the ULFA in Nagaon, identified as Siba Rajbongsi alias Rajen Gohain, was arrested by the Army from Diphu in the Karbi Anglong district on June 3.",IND,"a 'd istrict commander ' of the ULFA in Nagaon , identified as Siba Rajbongsi alias Rajen Gohain ,",istrict commander ulfa identified siba rajbongsi alias rajen gohain,person,terrorist,not-assigned,NA88455,45610,arrested,arrest,"A cadre belonging to Umar Farooq faction of the PULF, identified as Mohammed Hedayatullah (31), was arrested by the Assam Rifles personnel from Yairipok area in Thoubal District on August 21.",IND,"A cadre belonging to Umar Farooq faction of the PULF , identified as Mohammed Hedayatullah ( 31 ) ,",cadre belonging to umar farooq faction pulf identified mohammed hedayatullah,person,terrorist,not-assigned,NA67386,35685,arrested,arrest,Another suspected cadre of the same faction was arrested from the encounter site.,IND,Another suspected cadre of the same faction from the encounter site,suspected cadre same faction encounter site,person,terrorist,not-assigned,NA55842,31015,arrested,arrest,"Further, the Superintendent of Police (Handwara), Haseeb Mughal, disclosed that Abdul Majeed Dar alias Bhambar Khan, a released Pakistan trained militant of the HM, was arrested from Chogal in the Kupwara district.",IND,"Abdul Majeed Dar alias Bhambar Khan , a released Pakistan trained militant of the HM , from Chogal in the Kupwara district",abdul majeed dar alias bhambar khan released trained militant hm chogal district,person,terrorist,not-assigned,NA73635,38554,surrendered,surrend,"According to Tripurainfo, one National Liberation Front of Tripura (NLFT) militant, identified as Rajprasad Reang (22) alias Hizack, a resident of Shibdhan Para village under Ganganagar Police Station in Dhalai District, surrendered before the Sub-Divisional Police Officer of Ampi, Mayajay Rupani, along with ten live cartridges of AK series rifle on May 4. Police sources said Rajprasad was a self-styled <fc><be><8c><93><a4><bc>corporal' of the NLFT.",IND,"one National Liberation Front of Tripura ( NLFT ) militant , identified as Rajprasad Reang ( 22 ) alias Hizack , a resident of Shibdhan Para village",national liberation front tripura nlft militant identified rajprasad reang alias hizack resident village,person,terrorist,not-assigned,NA89660,46134,arrested,arrest,Two cadres of the Kangleipak Communist Party (KCP) were arrested from Singjamei Mayengbam Leikai near Numaligarh Refinery Limited (NRL) Oil Pump on September 23.,IND,Two cadres of the Kangleipak Communist Party ( KCP ) from Singjamei Mayengbam Leikai,cadres kangleipak communist party kcp singjamei mayengbam leikai,person,terrorist,not-assigned,NA5154,2330,killed,kill,"According official sources, on February 8, a terrorist of the Achik National Volunteer Council (ANVC) was killed in an encounter at Nangalbibre coal belt in south Garo Hills.",IND,a terrorist of the Achik National Volunteer Council ( ANVC ),terrorist achik national volunteer council anvc,person,terrorist,not-assigned,NA99496,51196,arrested,arrest,"Seven People's Liberation Front of India (PLFI) cadres were arrested with arms and ammunition from Jamuari Masu Hesal Majila Toli in Angara in Ranchi District, on August 13, reports The Telegraph.",IND,Seven People 's Liberation Front of India ( PLFI ) cadres with arms and ammunition from Jamuari Masu Hesal Majila Toli in Angara in Ranchi District,people liberation front india plfi cadres arms and ammunition jamuari masu hesal majila toli district,person,terrorist,not-assigned,NA85370,44231,arrested,arrest,Four cadres belonging to the People's Liberation Front of India (PLFI) were arrested from Silamkot jungle area while a Maoist commander was arrested from Visunpur village of the District.,IND,Four cadres belonging to the People 's Liberation Front of India ( PLFI ) from Silamkot jungle area,cadres belonging to people liberation front india plfi jungle area,person,terrorist,not-assigned,NA41141,24173,arrested,arrest,"An Hynniewtrep National Liberation Council (HNLC) cadre, Khrawkupar Shylla alias Khro, was arrested from Mawlai Nongk-war in the East Khasi Hills district on March 21, according to Shillong Times.",IND,"An Hynniewtrep National Liberation Council ( HNLC ) cadre , Khrawkupar Shylla alias Khro , from Mawlai Nongk war",hynniewtrep national liberation council hnlc cadre khrawkupar shylla alias khro mawlai nongk war,person,terrorist,not-assigned,NA95506,49266,arrested,arrest,"Further, SFs arrested one People's Revolutionary Party of Kangleipak (PREPAK), identified as Mayanglambam Ibomcha Singh alias Sarkar, from Jalal Provision area of Thangal Bazar in Imphal West District.",IND,"one People 's Revolutionary Party of Kangleipak ( PREPAK ) , identified as Mayanglambam Ibomcha Singh alias Sarkar , from Jalal Provision area of Thangal Bazar in Imphal West District",people revolutionary party kangleipak prepak identified mayanglambam ibomcha singh alias sarkar jalal provision area district,person,terrorist,not-assigned,NA120524,60298,arrested,arrest,"Two women cadres of the People''s Liberation Army (PLA), identified as Soraisam Rose Chanu alias Rani and Huidrom Ibetombi Devi, were arrested by a combined force of the Thoubal District Police and Assam Rifles from Wabagai Thingel Leikai Dam Makhong area on July 16, according to Sangai Express.",IND,"Two women cadres of the People '' s Liberation Army ( PLA ) , identified as Soraisam Rose Chanu alias Rani and Huidrom Ibetombi Devi ,",women cadres people liberation army pla identified soraisam rose chanu alias rani and huidrom ibetombi devi,person,terrorist,not-assigned,NA57296,31605,arrested,arrest,"One unidentified ULFA agent, who bailed out militants by providing false documents to courts, was arrested by the Army from Binoy Gutia village under Borboree police station in the Dibrugarh district on December 7, reports Press Trust of India.",IND,"One unidentified ULFA agent , who bailed out militants by providing false documents to courts ,",unidentified ulfa agent who bailed out militants providing false documents to courts,person,terrorist,not-assigned,NA77104,40281,arrested,arrest,"Further, a militant belonging to the Military Council faction of the Kangleipak Communist Party (KCP), identified as Mohammed Sahoruddin alias Ibothoi (31), was arrested by the Thoubal District Police from Langathel Khunou on October 3.",IND,"a militant belonging to the Military Council faction of the Kangleipak Communist Party ( KCP ) , identified as Mohammed Sahoruddin alias Ibothoi ( 31 ) ,",militant belonging to military council faction kangleipak communist party kcp identified mohammed sahoruddin alias ibothoi,person,terrorist,not-assigned,NA66266,35214,arrested,arrest,"Separately, a Kanglei Yawol Kanna Lup (KYKL) cadre, Sagolsem Manao, was arrested during a search operation at Samaram area in the Thoubal district on October 7, according to Sangai Express.",IND,"a Kanglei Yawol Kanna Lup ( KYKL ) cadre , Sagolsem Manao ,",kanglei yawol kanna lup kykl cadre sagolsem manao,person,terrorist,not-assigned,NA86751,44850,arrested,arrest,"During this period, 2,043 ULFA cadres, 899 NDFB cadres and 102 KLNLF cadres surrendered before the Government and 10,242 members of various militant outfits were arrested.",IND,"the Government and 10,242 members of various militant outfits",government and members various militant outfits,person,terrorist,not-assigned,NA115699,58226,killed,kill,"Security Forces (SFs) killed a suspected Garo National Liberation Army (GNLA) militant at Medhikona under Dhupdhara Police Station in Goalpara District on October 8, reports The Sentinel.",IND,a suspected Garo National Liberation Army ( GNLA ) militant,suspected garo national liberation army gnla militant,person,terrorist,not-assigned,NA102948,52831,arrested,arrest,"Separately, a suspected Maoist cadre involved in the attack on the camp of the Commando Battalion for Resolute Action (CoBRA) in Dumaria Police Station was arrested outside the CoBRA camp under Dumaria Police Station area in the District, reports DNA.",IND,a suspected Maoist cadre involved in the attack on the camp of the Commando Battalion for Resolute Action ( CoBRA ) in Dumaria Police Station,suspected maoist cadre involved attack camp commando battalion resolute action cobra dumaria police station,person,terrorist,maoist,NA102175,52476,arrested,arrest,"Meanwhile, Security Forces arrested one cadre of UNLF identified as M Amarjeet Singh alias Enao (26) from Moirang in Bishnupur District on October 30.",IND,one cadre of UNLF identified as M Amarjeet Singh alias Enao ( 26 ) from Moirang in Bishnupur District,cadre unlf identified amarjeet singh alias enao moirang,person,terrorist,not-assigned,NA89762,46179,arrested,arrest,"Further, Assam Chief Minister Tarun Gogoi confirmed the reports that the ULFA militants and their family members had neither been arrested nor had they surrendered, according to  Telegraph.",IND,the ULFA militants and their family members neither,ulfa militants and their family members,person,terrorist,not-assigned,NA33626,19961,killed,kill,"Meanwhile, Kashmir Times has reported that an Al Badr cadre was killed in a snow avalanche at Qazigund in the Anantnag district.",IND,an Al Badr cadre,al badr cadre,person,terrorist,not-assigned,NA130530,64584,killed,kill,"Security Forces (SFs) in an encounter killed a National Santhal Liberation Army (NSLA) militant, identified as Mundra Hansda, in the Matiapara village under Sapkata outpost of Kokrajhar District on July 29, reports The Shillong Times.",IND,a National Santhal Liberation Army ( NSLA ) militant,national santhal liberation army nsla militant,person,terrorist,not-assigned,NA22246,13031,killed,kill,"Reports said, National Liberation Front of Tripura (NLFT) terrorists killed a surrendered All Tripura Tiger Force (ATTF) terrorist in Kalyanpur, West Tripura district, on April 16-night.",IND,a surrendered All Tripura Tiger Force ( ATTF ) terrorist,surrendered tiger force attf terrorist,person,terrorist,not-assigned,NA126961,63042,arrested,arrest,"Also, Security Forces, on April 27, arrested K Ginsuanlian cadre of Zomi Revolutionary Front (ZRF) in Churachandpur District.",IND,K Ginsuanlian cadre of Zomi Revolutionary Front ( ZRF ) in Churachandpur District,ginsuanlian cadre zomi revolutionary front zrf,person,terrorist,not-assigned,NA25851,15630,arrested,arrest,"In another incident on the same day, security forces belonging to the Assam Rifles arrested a Bru National Liberation Front (BNLF) cadre from Phuldongshai area in Dhalai district and recovered one country made gun and a pistol from him.",IND,a Bru National Liberation Front ( BNLF ) cadre from Phuldongshai area in Dhalai district,bru national liberation front bnlf cadre area district,person,terrorist,not-assigned,NA21050,12235,killed,kill,"Separately, terrorists of the Borok National Council of Tripura (BNCT), a front organisation of the proscribed National Liberation Front of Tripura (NLFT), raided Dukhiapara village, Kalyanpur police station-limits, on February 16 night and killed Subhash Burman, a CPI-M supporter.",IND,"Subhash Burman , a CPI-M supporter",subhash burman cpi supporter,person,terrorist,maoist,NA9137,4275,killed,kill,"On August 10, a suspected terrorist of the Bru National Liberation Front (BNLF) was killed in an encounter at Bhuban Hill in Cachar District.",IND,a suspected terrorist of the Bru National Liberation Front ( BNLF ),suspected terrorist bru national liberation front bnlf,person,terrorist,not-assigned,NA54263,30299,killed,kill,"Elsewhere in the district, Black Widow militants killed a cadre of the Nunisa faction of the Dima Halim Daogah (DHD), identified as Lal Khelma, in an internecine clash at his residence near Umrangsu town on the same day.",IND,"a cadre of the Nunisa faction of the Dima Halim Daogah ( DHD ) , identified as Lal Khelma , in an internecine clash at his residence near Umrangsu town on the same day.",cadre nunisa faction dima halim daogah dhd identified lal khelma internecine clash his residence town same day,person,terrorist,not-assigned,NA64808,34641,arrested,arrest,"Assam Rifles arrested two over ground workers of the People's Liberation Army (PLA), identified as Angom Gojen Singh and his wife Anju Devi, from Tengnoupal on August 24, according to Sangai Express.",IND,two over ground workers of the People 's Liberation Army ( PLA ),ground workers people liberation army pla,person,terrorist,not-assigned,NA123939,61780,arrested,arrest,The Shillong Times reports that Police in West Garo Hills District arrested a Garo National Liberation Army (GNLA) cadre and recovered a crude bomb from his possession on February 11.,IND,a Garo National Liberation Army ( GNLA ) cadre,national liberation army gnla cadre,person,terrorist,not-assigned,NA99497,51197,arrested,arrest,"Kanglaonline reports that while a militant of Noyon faction of Kangleipak Communist Party (KCP-Noyon) was arrested from Malom Awang Lekai in Imphal West on August 13, one People's Liberation Army (PLA) militant was arrested in the Ukhongsang on August 14.",IND,one People 's Liberation Army ( PLA ) militant,people liberation army pla militant,person,terrorist,not-assigned,NA34211,20302,killed,kill,"A group of terrorists are reported to have killed the mother, wife and infant daughter of a surrendered militant, Mohammad Shabir Gujjar, in the Hassote village of Udhampur district on March 26.",IND,"the mother , wife and infant daughter of a surrendered militant",mother wife and infant daughter surrendered militant,person,terrorist,not-assigned,NA49587,28033,arrested,arrest,"A People's Liberation Army (PLA) militant, Laishram Angou, was arrested from his residence at Mayang Imphal Bazaar in the Imphal West district on February 23, according to Sangai Express.",IND,"A People 's Liberation Army ( PLA ) militant , Laishram Angou , from his residence",people liberation army pla militant laishram angou his residence,person,terrorist,not-assigned,NA79260,41369,wounded,wound,Two former BLT cadres were also wounded in the attack.,IND,Two former BLT cadres,former blt cadres,person,terrorist,not-assigned,NA66340,35241,arrested,arrest,"Two Kangleipak Communist Party (KCP) cadres, Moirangthem Sharat and his wife Nungsitombi, were arrested by the Imphal East district police commandos from Checkon.",IND,"Two Kangleipak Communist Party ( KCP ) cadres , Moirangthem Sharat and his wife Nungsitombi ,",kangleipak communist party kcp cadres moirangthem sharat and his wife nungsitombi,person,terrorist,not-assigned,NA91784,47245,killed,kill,"The Hindu reports that Communist Party of India-Maoist (CPI-Maoist) cadres killed a local leader of the ruling Communist Party of India-Marxist (CPI-M), identified as Shasthi Bawri, inside the party office at Khairasol in Birbhum District on December 9. Sasti was shot at by armed Maoists who fled on motorbikes, Superintendent of Police (SP) Humayun Kabir said.",IND,a local leader of the ruling Communist Party of India-Marxist ( CPI-M ),local leader ruling communist party india marxist cpi,person,terrorist,maoist,NA69962,36834,arrested,arrest,"Two Kangleipak Communist Party (KCP) militants, including their leader, were arrested by a combined force of Manipur Police, Army, Delhi Police and Bangalore Police in Bangalore city on January 20, according to Sentinel.",IND,"Two Kangleipak Communist Party ( KCP ) militants , including their leader ,",kangleipak communist party kcp militants including their leader,person,terrorist,not-assigned,NA91195,46926,arrested,arrest,"Also, Imphal West District Police arrested one cadre of PREPAK identified as Ningombam Lokeshor Singh  alias Ngamba (40).",IND,one cadre of PREPAK identified as Ningombam Lokeshor Singh alias Ngamba ( 40).,cadre prepak identified ningombam lokeshor singh alias ngamba,person,terrorist,not-assigned,NA