pid,rid,verb,verbstem,sentence,ISO3,object,objectcleanpp,objecttype,label1,label2,group50579,28487,surrendered,surrend,"Soyam Ansu Bai alias Godavari alias Deepa, deputy commander of Jimmalgatta dalam (squad) of the Communist Party of India-Maoist (CPI-Maoist) in the Gadchiroli district of Maharashtra surrendered to Adilabad district police in Andhra Pradesh on April 6, reports The Hindu.",IND,to Adilabad district police in Andhra Pradesh,to district police,person,security,,NA36622,21634,shot,shot,"One Territorial Army personnel, Abdur Rasheed Rather, was shot at and wounded by terrorists at Panzeth in the Qazigund area.",IND,"One Territorial Army personnel Abdur Rasheed Rather ,",territorial army personnel abdur rasheed rather,person,security,,NA70748,37201,killing,kill,"Police in France arrested six Sri Lankan Tamils accused of killing a Police officer in Paris, officials said.",LKA,a Police officer,police officer,person,security,,NA132971,65577,killing,kill,"<fc><be><8c><b3><a4><bc>The Assam Police have been killing our unarmed supporters and well wishersthe situation has reached such a level that now we are going to target unarmed Police officials who are not on duty,<fc><be><8d><83><a4><bc> threatened <fc><be><8c><93><a4><bc>assistant publicity secretary' of ULFA-I, Arunodoi Asom, on September 24, adds The Sentinel.",IND,"our unarmed supporters and well wishersthe situation has reached such a level that now we are going to target unarmed Police officials who are not on duty , < fc > < be > < 8d > < 83 > < a4 > < bc > threatened < fc > < be > < 8c > < 93 > < a4 > < bc > assistant publicity secretary ' of ULFA - I , Arunodoi Asom , on September 24 , adds The Sentinel",our unarmed supporters and well wishersthe situation has reached level now we are going to target police officials who not duty fc be bc threatened assistant publicity secretary arunodoi asom september adds,person,security,,NA95187,49126,injured,injur,"Two Border Security Force (BSF) jawans (troopers) Manoj Kumar and S.M. Patel were injured when an Improvised Explosive Device (IED) went off near the Line of Control (LoC) in Sinagali area of Poonch District of Jammu and Kashmir on April 16, reports The Hindu.",IND,Two Border Security Force ( BSF ) jawans ( troopers ) Manoj Kumar and S.M. Patel,border security force bsf jawans troopers manoj kumar and patel,person,security,,NA98583,50793,arrest,arrest,"Separately, the Jharkhand Police are planning to change strategy to arrest Maoist leader Kundan Pahan, the alleged killer of Ramesh Singh Munda, a Janata Dal United MLA and two Police officers, including Special Branch Inspector Francis Indwar, in 2009.",IND,"Maoist leader Kundan Pahan , the alleged killer of Ramesh Singh Munda , a Janata Dal United MLA and two Police officers , including Special Branch Inspector Francis Indwar , in 2009.",maoist leader kundan pahan alleged killer ramesh singh munda janata dal united mla and police officers including special branch inspector francis indwar,person,security,,NA45794,26230,injured,injur,Two special police officers (SPOs) were injured during the encounter.,IND,Two special police officers ( SPOs ),special police officers spos,person,security,,NA24794,14935,injuring,injur,"However, it fell short of the intended target and exploded on the road, killing one civilian and injuring 11 others and one BSF personnel.",IND,11 others and one BSF personnel,others and bsf personnel,person,security,,NA28167,16948,injured,injur,A Special Police Officer was injured during a grenade blast at village Seri in the Bhaderwah town.,IND,A Special Police Officer,special police officer,person,security,,NA112425,56910,arrested,arrest,"On July 16, Police received information about the gang headed by Farukh and Abrar, and sent a decoy customer to strike a deal with them, around 5.30pm two persons came to a pre-designated spot near north Delhi's Mukarba Chowk and were arrested as soon as they stuck a deal with the decoy customer.",IND,Police two persons,police persons,person,security,,NA43382,25275,killed,kill,"An Army Captain, S.B. Singh, was killed and a soldier was injured in a separate encounter during subsequent cordon and search operation in the area following information that more terrorists were hiding in some houses.",IND,"An Army Captain , S.B. Singh ,",army captain singh,person,security,,NA1044,511,killed,kill,"Earlier, on May 12, militants killed a Special Police Officer (SPO) and injured a civilian in separate incidents.",IND,a Special Police Officer ( SPO ),special police officer spo,person,security,,NA127367,63221,killed,kill,"Militants killed a mosque's Imam (Prayer leader), a Police officer and a farmer in three separate incidents in Pulwama District, India Today reports on May 11.",IND,"a mosque 's Imam ( Prayer leader ) , a Police officer and a farmer",mosque imam prayer leader police officer and farmer,person,security,,NA57563,31721,injured,injur,Three Maoists and unspecified numbers of police personnel were also injured in the encounter.,IND,Three Maoists and unspecified numbers of police personnel,maoists and unspecified numbers police personnel,person,security,,NA131691,65073,killed,kill,"A Company Commander of Chhattisgarh Special Task Force (STF) Lav Bhagat and a Constable Shiv Kumar were killed in an encounter with Communist Party of India-Maoist (CPI-Maoist) cadres near Harra Koder village under Mardum Police Station area of Bastar District on August 27, reports The Times of India.",IND,A Company Commander of Chhattisgarh Special Task Force ( STF ) Lav Bhagat and a Constable Shiv Kumar,company commander chhattisgarh special task force stf lav bhagat and constable shiv kumar,person,security,,NA107844,55055,arrested,arrest,"In the other incident, SFs arrested two more persons identified as Ranjit Teron alias Pradip and Dakiram Tokbi alias Jiten Tokbi from near ASEB colony under Diphu Police Station at around 7 pm.",IND,two more persons identified as Ranjit Teron alias Pradip and Dakiram Tokbi alias Jiten Tokbi from near ASEB colony under Diphu Police Station at around 7 pm,more persons identified ranjit teron alias pradip and dakiram tokbi jiten near colony diphu police station pm,person,security,,NA34278,20338,killed,kill,Two terrorists and a paramilitary soldier were killed when a group of two Fidayeen (suicide squad) terrorists attempted to storm a Border Security Force (BSF) post at Arampora in the Sopore town of Baramulla district on March 30.,IND,Two terrorists and a paramilitary soldier,terrorists and paramilitary soldier,person,security,,NA72794,38175,arrested,arrest,"Elsewhere in the State, Police arrested a LeT militant, identified as Manzoor Ahmed, from village Dhodi in the Rajouri District for the killing of a Special Police Officer (SPO) Khadim Hussain Shah of Budhal Police station, whose body was recovered on May 7. Shah's throat had been slit by the militants.",IND,"a LeT militant , identified as Manzoor Ahmed , from village Dhodi in the Rajouri District for the killing of a Special Police Officer ( SPO ) Khadim Hussain Shah of Budhal Police station , whose body was recovered on May 7. Shah 's throat had been slit by the militants",let militant identified manzoor ahmed village dhodi killing special police officer spo khadim hussain shah budhal station whose body was recovered may throat had been slit militants,person,security,,NA23425,13896,injured,injur,"In another incident, an Assistant Commandant of the Border Security Force (BSF) was injured during an encounter with the terrorists at Kopra hill under the jurisdiction of Ramban police district, on June 21.",IND,an Assistant Commandant of the Border Security Force ( BSF ),assistant commandant border security force bsf,person,security,,NA32607,19383,injured,injur,"In a separate incident on the same day, the Naxalites triggered another landmine explosion in the Latehar district of Jharkhand State, in which two Central Reserve Police Force personnel and a driver were injured.",IND,two Central Reserve Police Force personnel and a driver,central reserve police force personnel and driver,person,security,,NA6356,2866,injured,injur,"A suspected Hizb-ul-Mujahideen (HM) terrorist was killed and four security force (SF) personnel, including an officer, injured during an encounter at Warpora in Baramulla district on April 11.",IND,"A suspected Hizb - ul - Mujahideen ( HM ) terrorist four security force ( SF ) personnel an officer ,",suspected hizb ul mujahideen hm terrorist security force sf personnel officer,person,security,,NA129706,64218,injured,injur,"Separately, two personnel of Special Operations Group (SOG) Srinagar were injured when two grenades were fired on their bunker at Lawveypora on the national highway in the outskirts of Srinagar.",IND,two personnel of Special Operations Group ( SOG ) Srinagar,personnel special operations group sog,person,security,,NA3945,1792,killed,kill,"A Special Police Officer (SPO) was killed in an attack by unidentified terrorists in Jammu an Kashmir, in Gandoh, Doda district, on December 12.",IND,A Special Police Officer ( SPO ),special police officer spo,person,security,,NA50418,28420,killed,kill,"Meanwhile, two cadres of the Hizb-ul-Mujahideen (HM), identified as Saifullah, a <fc><be><8c><93><a4><bc>tehsil commander' and Faisal, a <fc><be><8c><93><a4><bc>section commander', and a personnel of the Territorial Army, Ravinder Kumar, were killed in an encounter at Kushal in the Chatru area of Doda district.",IND,"two cadres of the Hizb - ul - Mujahideen ( HM ) , identified as Saifullah , a < fc > < be > < 8c > < 93 > < a4 > < bc > tehsil commander ' and Faisal , a < fc > < be > < 8c > < 93 > < a4 > < bc > section commander ' , and a personnel of the Territorial Army , Ravinder Kumar ,",cadres hizb ul mujahideen hm identified saifullah fc be bc tehsil commander and faisal section personnel territorial army ravinder kumar,person,security,,NA69059,36431,arrested,arrest,"Of the six arrested, Raghunathpur Police had arrested five and Riamal Police of Deogarh District had arrested another Maoist from Erasama area few months ago.",IND,five and Riamal Police of Deogarh District had arrested another Maoist from Erasama area few months ago,and riamal police deogarh district had arrested maoist area few months ago,person,security,,NA102433,52594,injured,injur,"Seven Security Force personnel, five of Jharkhand Jaguar and two of District Police, were injured when a school-turned-camp collapsed by a series of land-mine explosions triggered by the Communist Party of India-Maoist (CPI-Maoist) cadres at Kone village in Latehar District early on November 8, reports The Times of India.",IND,"Seven Security Force personnel , five of Jharkhand Jaguar and two of District Police ,",seven security force personnel jharkhand jaguar and district police,person,security,,NA24480,14699,killed,kill,"Meanwhile, one BSF personnel was killed when a patrol party was attacked by a terrorist who had been called to halt for frisking in the Batmaloo area of Srinagar.",IND,one BSF personnel,bsf personnel,person,security,,NA880,432,killed,kill,Three militants and a Border Security Force (BSF) officer were killed at Dangerpora village in the district.,IND,Three militants and a Border Security Force ( BSF ) officer,militants and border security force bsf officer,person,security,,NA37527,22104,wounded,wound,A police constable was wounded in continued gun-fighting between the terrorists and security forces in the Malhar area of Kathua district.,IND,A police constable in continued gun - fighting between the terrorists and security forces in the Malhar area of Kathua district,police constable continued gun fighting terrorists and security forces area district,person,security,,NA77658,40564,killed,kill,"Five Communist Party of India-Maoist (CPI-Maoist) cadres and four Security Force personnel were killed in separate attacks in three Districts of the Bastar region in southern Chhattisgarh on October 25, reports Hindustan Times.",IND,Five Communist Party of India - Maoist ( CPI-M aoist ) cadres and four Security Force personnel,communist party india maoist cpi aoist cadres and security force personnel,person,security,,NA66539,35316,arrested,arrest,"Meanwhile, troopers of the Red Horns Division of the Army arrested two suspected ULFA cadres from the Agomoni areas under Golokganj police station in Dhubri district on October 14-night, reports Sentinel.",IND,two suspected ULFA cadres from the Agomoni areas under Golokganj police station in Dhubri district on October 14-n ight,suspected ulfa cadres areas golokganj police station district october ight,person,security,,NA137325,67214,arrested,arrest,"Acting on a tip off, the Central Reserve Police Force (CRPF) and the Special Task Force (STF) jointly raided a hideout and arrested the Maoists duo, identified as Manoj Kumar Agrawal alias Agrawal ji, and Baitha, Additional Superintendent of Police (ASP), Operation, Sanjay Singh said.",IND,"the Maoists duo , identified as Manoj Kumar Agrawal alias Agrawal ji , and Baitha , Additional Superintendent of Police ( ASP ) , Operation",maoists duo identified manoj kumar agrawal alias ji and baitha additional superintendent police asp operation,person,security,,NA5128,2319,killed,kill,"In another incident, a woman Special Police Officer (SPO) was killed by unidentified terrorists at village Zadoora in the Pulwama district on the same day.",IND,a woman Special Police Officer ( SPO ),woman special police officer spo,person,security,,NA53726,30034,killed,kill,"Meanwhile, a Special Police Officer, Baldev Singh, was killed in an ambush laid by the militants at Seri Top under the jurisdiction of Assar police station in Doda district.",IND,"a Special Police Officer , Baldev Singh ,",special police officer baldev singh,person,security,,NA15597,9120,surrendered,surrend,"Separately, a PWG Naxalite of the Kamareddy-Sirnapalli Local Guerilla Squad (LGS) surrendered to the Nizamabad district police chief.",IND,to the Nizamabad district police chief,to district police chief,person,security,,NA35752,21169,killed,kill,Three Special Police Officers (SPO) were reportedly killed and two others were missing during a search operation at Barha Draman in the Budhal area of Rajouri district on June 16.,IND,Three Special Police Officers ( SPO ),special police officers spo,person,security,,NA16717,9833,injured,injur,"Separately, four persons, including two Special Police Officers (SPOs), were injured when terrorists hurled a grenade at a Security Forces (SFs) patrol party in Kulgam, Anantnag district.",IND,"four persons , including two Special Police Officers ( SPOs ) ,",persons including special police officers spos,person,security,,NA24514,14742,killed,kill,One BSF personnel was killed and eight other security force personnel were injured in the encounter.,IND,One BSF personnel,bsf personnel,person,security,,NA37244,21962,arrested,arrest,"On the same day, TSR personnel arrested Bipul Debbarma, a collaborator of an unspecified militant outfit, from Manik Chowdhury Para under Champahawor police station.",IND,"Bipul Debbarma , a collaborator of an unspecified militant outfit , from Manik Chowdhury Para under Champahawor police station",bipul debbarma collaborator unspecified militant outfit champahawor police station,person,security,,NA86521,44757,arrested,arrest,"Further, the Police on July 7 arrested a member of the Jharkhand Jan Sangharsh Mukti Morcha, a splinter group of CPI-Maoist, from a place near the Shankh river Police outpost in Lohardaga District.",IND,"a member of the Jharkhand Jan Sangharsh Mukti Morcha , a splinter group of CPI-M aoist , from a place near the Shankh river Police outpost in Lohardaga District",member splinter group cpi aoist place outpost,person,security,,NA28406,17089,wounded,wound,"Further, one Army personnel was wounded during an encounter with a group of terrorists at Koti Dashnan in the Doda district.",IND,one Army personnel,army personnel,person,security,,NA6622,2995,killed,kill,"A civilian, reported to be working with SF personnel as an informer, was killed by unidentified terrorists at Furra in Anantnag district.",IND,"A civilian , reported to be working with SF personnel as an informer ,",civilian reported to be working sf personnel informer,person,security,,NA79579,41513,killed,kill,"A Border Security Force (BSF) trooper was killed and two others were injured as a group of militants opened firing on them after infiltrating into Indian Territory from the Line of Control (LoC) in Krishna Ghati sector of Poonch District in the morning of December 19, according to Daily Excelsior.",IND,BSF ) trooper,bsf trooper,person,security,,NA12339,7044,killed,kill,"In Udhampur district, four Special Police Officers (SPOs) were killed while six others were reported missing after their group was ambushed by unidentified terrorists at Gool Gulabgarh.",IND,four Special Police Officers ( SPOs ),special police officers spos,person,security,,NA4300,1943,killed,kill,"In a separate incident, a suspected police informer was killed by terrorists in Lolab area in Kupwara district.",IND,a suspected police informer,suspected police informer,person,security,,NA73727,38592,injured,injur,"CRPF Assistant Commander P Singh, two head constables and three Special Police Officers were injured in the incident.",IND,"CRPF Assistant Commander P Singh , two head constables and three Special Police Officers",crpf assistant commander singh head constables and special police officers,person,security,,NA29051,17528,wounded,wound,"In the same district, four personnel of the 16 Rashtriya Rifles were wounded in an IED blast triggered by terrorists at Sailan area.",IND,four personnel of the 16 Rashtriya Rifles,personnel rashtriya rifles,person,security,,NA9473,4830,wounded,wound,"While the number of LTTE casualties is not known, the Army confirmed that an Army officer was wounded in the clashes.",LKA,an Army officer,army officer,person,security,,NA50955,28685,killed,kill,More than 20 police informers have reportedly been killed in the last one year in Jharkhand.,IND,More than 20 police informers,more police informers,person,security,,NA80221,41774,arrested,arrest,"The extremists were arrested from forests near Kamakut village, Superintendent of Police Amresh Mishra told PTI.",IND,"The extremists from forests near Kamakut village , Superintendent of Police Amresh Mishra told PTI",extremists forests village superintendent police amresh mishra told pti,person,security,,NA23403,13876,killed,kill,"On June 20, one United Liberation Front of Asom (ULFA) terrorist and two personnel of the Central Industrial Security Force (CISF) were killed in an encounter at Nagajan in Assam's Tinsukia district.",IND,one United Liberation Front of Asom ( ULFA ) terrorist and two personnel of the Central Industrial Security Force ( CISF ),united liberation front asom ulfa terrorist and personnel central industrial security force cisf,person,security,,NA1566,746,killed,kill,Terrorists killed an informer of security forces at Tujar Sharief in Baramulla district.,IND,an informer of security forces,informer security forces,person,security,,NA5651,2556,surrendered,surrend,The two surrendered terrorists informed the police that a serious internal feud is brewing within the NLFT.,IND,terrorists informed the police that a serious internal feud is brewing within the NLFT,terrorists informed police serious internal feud is brewing nlft,person,security,,NA78926,41208,injured,injur,"Meanwhile, one Border Security Force (BSF) trooper, Chandrip Singh, was injured in an exchange of fire with Maoists in a jungle near Pirakulli at Salboni in the district.",IND,"one Border Security Force ( BSF ) trooper , Chandrip Singh ,",border security force bsf trooper chandrip singh,person,security,,NA41508,24372,arrested,arrest,"Elsewhere in the district, an All Tripura Tiger Force (ATTF) collaborator, Dhanichand Debbarma, was arrested following an encounter between the security force personnel and cadres of the outfit led by its <fc><be><8c><93><a4><bc>area commander' Smith Debbarma at a place under Khowai police station, reports Tripurainfo.",IND,"an All Tripura Tiger Force ( ATTF ) collaborator , Dhanichand Debbarma ,",all tripura tiger force attf collaborator dhanichand debbarma,person,security,,NA8838,4097,injured,injur,"On July 30, in an encounter between a Border Security Force (BSF) patrol party and terrorists at Moirang Bazar in Bishnupur district, a civilian was killed while a BSF personnel was injured.",IND,a BSF personnel,bsf personnel,person,security,,NA47179,26898,injured,injur,"One Army personnel, Mohammed Amin, was shot dead and his neighbour, who came to his rescue, was injured by two terrorists at Pangai in the Thannamandi area of Rajouri district on November 9, according to Daily Excelsior.;",IND,"One Army personnel , Mohammed Amin , was shot dead and his neighbour , who came to his rescue ,",army personnel mohammed amin was shot dead and his neighbour who came to rescue,person,security,,NA78898,41193,killed,kill,"Though Marandi escaped unhurt, an assistant sub-inspector of Police and two personnel of Special Operation Group (SOG) were killed in the attack, the Police said.",IND,an assistant sub - inspector of Police and two personnel of Special Operation Group ( SOG ),assistant sub inspector police and personnel special operation group sog,person,security,,NA23795,14170,injured,injur,"Three Jaish-e-Mohammad (JeM) terrorists were killed and three security force (SF) personnel were injured during an encounter at Fatlipora village, Budgam district on July 14.",IND,Three Jaish - e - Mohammad ( JeM ) terrorists were killed and three security force ( SF ) personnel,jaish mohammad jem terrorists were killed and security force sf personnel,person,security,,NA63247,34039,killed,kill,"Head constable Mohammed Irfan was killed and another policeman, Muzaffar Ahmad, sustained injuries in a grenade attack by militants in the Handwara town of Kupwara district on July 10, Tribune reported.",IND,Head constable Mohammed Irfan,head constable mohammed irfan,person,security,,NA85907,44479,killed,kill,"IANS reports that a senior Army officer, Colonel Neeraj Sood, commanding officer of Rashtriya Rifles (RR, 18th Battalion), was killed in an ambush by the militants at Saiwan village in the Lolab Valley of Kupwara District, Police said on June 23 (today).",IND,"a senior Army officer , Colonel Neeraj Sood , commanding officer of Rashtriya Rifles ( RR , 18th Battalion ) ,",senior army officer colonel neeraj sood commanding rashtriya rifles rr th battalion,person,security,,NA80380,41844,killed,kill,"A Border Security Force (BSF) trooper was killed in firing from across the border on January 11 as Security Forces (SFs) foiled two separate infiltration bids in Jammu region, reports PTI.",IND,A Border Security Force ( BSF ) trooper,border security force bsf trooper,person,security,,NA17735,10324,killed,kill,"In a separate incident, unidentified terrorists killed a Special Police Officer (SPO) at Ganderbal.",IND,a Special Police Officer ( SPO ) at Ganderbal,special police officer spo,person,security,,NA51356,28875,arrest,arrest,"Meanwhile, the State government has said it would not arrest the police personnel who were reportedly involved in the killing of tribals on March 31 at Ponjer in the Bijapur district, even as an official probe confirmed that the villagers were branded as Maoists and killed, reports New Indian Express.",IND,"the police personnel who were reportedly involved in the killing of tribals on March 31 at Ponjer in the Bijapur district , even as an official probe confirmed that the villagers were branded as Maoists and killed",police personnel who were reportedly involved killing tribals march district even official probe confirmed villagers branded maoists and killed,person,security,,NA29954,18057,killed,kill,"Around 11 AM, two security force personnel and the daughter of an Army Officer were killed while 17 people sustained injuries as an Improvised Explosive Device (IED) exploded and damaged a bus carrying Border Security Force (BSF) personnel from Tura to Guwahati, at Paikan village in the Goalpara district.",IND,two security force personnel and the daughter of an Army Officer,security force personnel and daughter army officer,person,security,,NA57399,31648,injured,injur,"Three constables of the Special Operation Group of the Orissa Police were injured when a claymore mine planted by the Communist Party of India-Maoist (CPI-Maoist) cadres exploded in the Malkangiri district on December 11, according to KalingaTimes.",IND,Three constables of the Special Operation Group of the Orissa Police,constables special operation group police,person,security,,NA78932,41211,firing,fire,"They burned down the vehicle and equipment, belonging to a private contractor, in protest against the ""firing by police against innocent tribals at Pydipalli in Pedabayalu mandal on November 22 and other incidents in which the tribals were killed, the Maoists mentioned.",IND,by police against innocent tribals at Pydipalli in Pedabayalu mandal on November 22 and other incidents in which the tribals were killed,police innocent tribals mandal november and other incidents were killed,person,security,,NA19845,11455,killed,kill,"Left-wing extremists<fc><be><8d><b3><a4><bc>Naxalites<fc><be><8d><b3><a4><bc>of the People's War Group (PWG) killed two persons, including a chowkidar (security guard) in Kakaria village, Kalpa police station-limits, Jehanabad district, police said on December 30.",IND,"two persons including a chowkidar ( security guard ) in Kakaria village , Kalpa police station - limits , Jehanabad district",persons including chowkidar security guard village police station limits district,person,security,,NA